<?xml version="1.0" encoding="UTF-8"?>
<plugin xmlns="urn:tolven-org:tpf:1.0" xmlns:xsi="http://www.w3.org/2001/XMLSchema-instance" xsi:schemaLocation="urn:tolven-org:tpf:1.0 http://tolven.org/xsd/tpf.xsd"
	id="org.tolven.cchit.progressnotes" version="2.1.0" vendor="Tolven">
	
	<requires>
	     <import plugin-id="org.tolven.component.tolvenejb" />
	     <import plugin-id="org.tolven.component.tolvenweb" />
		 <import plugin-id="org.tolven.component.application" />
		 <import plugin-id="org.tolven.component.war" />
		 <import plugin-id="org.tolven.component.tolvenear" />
		 <import plugin-id="org.tolven.component.tolvenweb.taglibs.trim" />		 
	</requires>

	<extension-point id="devLib" extension-multiplicity="none">
		<parameter-def id="jar" default-value="devLib.jar" />
	</extension-point>

	<extension id="applications" plugin-id="org.tolven.component.application" point-id="applications">
		<parameter id="dir" value="app" />
	</extension>
	<extension id="trims" plugin-id="org.tolven.component.application" point-id="trims">
		<parameter id="dir" value="app/trim" />
	</extension>
	
	<extension id="ejbclasses" plugin-id="org.tolven.component.tolvenejb" point-id="classes">
		<parameter id="dir" value="ejb/classes" />
	</extension>
	
	<extension id="ajaxDirectory" plugin-id="org.tolven.component.tolvenweb" point-id="ajaxDirectory">
	     <parameter id="sourceDirectory" value="web/ajax" />
	</extension>
	<extension id="drilldownDirectory" plugin-id="org.tolven.component.tolvenweb" point-id="drilldownDirectory">
	     <parameter id="sourceDirectory" value="web/drilldown" />
	</extension>
	<extension id="fiveDirectory" plugin-id="org.tolven.component.tolvenweb" point-id="fiveDirectory">
	     <parameter id="sourceDirectory" value="web/five" />
	</extension>
	<extension id="imagesDirectory" plugin-id="org.tolven.component.tolvenweb" point-id="imagesDirectory">
	     <parameter id="sourceDirectory" value="web/images" />
	</extension>
	<extension id="invitationDirectory" plugin-id="org.tolven.component.tolvenweb" point-id="invitationDirectory">
	     <parameter id="sourceDirectory" value="web/invitation" />
	</extension>
	<extension id="manageDirectory" plugin-id="org.tolven.component.tolvenweb" point-id="manageDirectory">
	     <parameter id="sourceDirectory" value="web/manage" />
	</extension>
	<extension id="privateDirectory" plugin-id="org.tolven.component.tolvenweb" point-id="privateDirectory">
	     <parameter id="sourceDirectory" value="web/private" />
	</extension>
	<extension id="publicDirectory" plugin-id="org.tolven.component.tolvenweb" point-id="publicDirectory">
	     <parameter id="sourceDirectory" value="web/public" />
	</extension>
	<extension id="scriptsDirectory" plugin-id="org.tolven.component.tolvenweb" point-id="scriptsDirectory">
	     <parameter id="sourceDirectory" value="web/scripts" />
	</extension>
	<extension id="stylesDirectory" plugin-id="org.tolven.component.tolvenweb" point-id="stylesDirectory">
	     <parameter id="sourceDirectory" value="web/styles" />
	</extension>
	<extension id="templatesDirectory" plugin-id="org.tolven.component.tolvenweb" point-id="templatesDirectory">
	     <parameter id="sourceDirectory" value="web/templates" />
	</extension>
	<extension id="wizardDirectory" plugin-id="org.tolven.component.tolvenweb" point-id="wizardDirectory">
	     <parameter id="sourceDirectory" value="web/wizard" />
	</extension>
	<extension id="progressNoteJavaScript" plugin-id="org.tolven.component.tolvenweb" point-id="portalScriptInclude">
		<parameter id="includeFile" value="scriptInclude/progressNoteScript.txt" />
	</extension>
	<extension id="tagSourceDirectory.trim" plugin-id="org.tolven.component.tolvenweb.taglibs.trim" point-id="tagSourceDirectory">
		<parameter id="source-directory" value="web/tags/trim" />
	</extension>
	
	<extension id="ProgressNoteWizardServlet" plugin-id="org.tolven.component.war" point-id="servlet">
		<parameter id="servlet-name" value="ProgressNoteWizardServlet" />
		<parameter id="servlet-class" value="org.tolven.ajax.ProgressNoteWizardServlet" />
		<parameter id="web-resource-name" value="Protected Area" />
		<parameter id="transaction" value="true" />
		<parameter id="load-on-startup" value="5" />
		<parameter id="target-plugin-id" value="org.tolven.component.tolvenweb" />
	</extension>
	<extension id="ProgressNoteWizardServletMapping" plugin-id="org.tolven.component.war" point-id="servlet-mapping-contribution">
		<parameter id="servlet-name" value="ProgressNoteWizardServlet" />
  		<parameter id="url-pattern" value="*.pnotes" />
  		<parameter id="target-plugin-id" value="org.tolven.component.tolvenweb" />
 	</extension>
	<extension id="warclasses" plugin-id="org.tolven.component.war" point-id="classes">
		<parameter id="dir" value="web/classes" />
		<parameter id="target-plugin-id" value="org.tolven.component.tolvenweb" />
	</extension>
</plugin>
