<?xml version="1.0" encoding="UTF-8" standalone="yes"?>
<plugin id="org.tolven.assembler.localemodule" version="2.1.0" class="org.tolven.assembler.localemodule.LocaleModuleAssembler" vendor="Tolven" xsi:schemaLocation="urn:tolven-org:tpf:1.0 http://tolven.org/xsd/tpf.xsd" xmlns="urn:tolven-org:tpf:1.0" xmlns:xsi="http://www.w3.org/2001/XMLSchema-instance">
	<runtime>
		<library type="code" path="tpf/classes/" id="classes" />
	</runtime>
	<extension-point extension-multiplicity="none" id="devLib">
		<parameter-def default-value="devLib.jar" id="jar" />
	</extension-point>
	<extension-point id="component">
		<parameter-def multiplicity="none-or-one" id="language-code" />
		<parameter-def id="jar" />
		<parameter-def id="target-plugin-id" />
	</extension-point>
</plugin>
