<?xml version="1.0" encoding="UTF-8" standalone="yes"?>
<plugin id="org.tolven.assembler.library" version="2.0.3" class="org.tolven.assembler.library.LibraryAssembler" vendor="Tolven" xsi:schemaLocation="urn:tolven-org:tpf:1.0 http://tolven.org/xsd/tpf.xsd" xmlns="urn:tolven-org:tpf:1.0" xmlns:xsi="http://www.w3.org/2001/XMLSchema-instance">
	<requires>
		<import plugin-id="org.tolven.component.library" />
	</requires>
	<runtime>
		<library type="code" path="tpf/classes/" id="classes" />
	</runtime>
	<extension-point extension-multiplicity="none" id="devLib">
		<parameter-def default-value="devLib.jar" id="jar" />
	</extension-point>
	<extension-point id="abstractLib" parent-plugin-id="org.tolven.component.library" parent-point-id="abstractLib" extension-multiplicity="none" />
</plugin>
