<?xml version="1.0" encoding="UTF-8"?>
<plugin id="org.tolven.api" version="2.1.0" vendor="Tolven" xmlns="urn:tolven-org:tpf:1.0" xmlns:xsi="http://www.w3.org/2001/XMLSchema-instance" xsi:schemaLocation="urn:tolven-org:tpf:1.0 http://tolven.org/xsd/tpf.xsd">
	<requires>
		<import plugin-id="org.tolven.component.war" />
		<import plugin-id="org.tolven.component.tolvenear" />
		<import plugin-id="org.tolven.component.composite" />
		<import plugin-id="org.tolven.assembler.war" />
		<import plugin-id="org.tolven.jaxrs" />
		<import plugin-id="org.tolven.component.tolvenejb" />
		<import plugin-id="org.tolven.api.schemas" />
	</requires>

	<extension-point id="warModule-declaration" parent-plugin-id="org.tolven.component.war" parent-point-id="warModule-declaration" extension-multiplicity="none">
		<parameter-def id="context-id" default-value="tolvenapi" />
	</extension-point>

	<!-- WAR Services -->
	<extension-point id="WEB-INF-LIB-adaptor" parent-plugin-id="org.tolven.component.war" parent-point-id="WEB-INF-LIB-adaptor" />
	<extension-point id="WEB-INF-CLASSES-adaptor" parent-plugin-id="org.tolven.component.war" parent-point-id="WEB-INF-CLASSES-adaptor" />
	<extension-point id="WEB-ROOT-FILES-adaptor" parent-plugin-id="org.tolven.component.war" parent-point-id="WEB-ROOT-FILES-adaptor" />
	<extension-point id="webDirectory-adaptor" parent-plugin-id="org.tolven.component.war" parent-point-id="webDirectory-adaptor" />
	<!-- WAR Services End -->

	<extension id="warModule" plugin-id="org.tolven.component.tolvenear" point-id="warModule">
		<parameter id="web-uri" value="tolvenAPI.war" />
		<parameter id="context-root" value="/api" />
	</extension>
	<extension id="composite" plugin-id="org.tolven.component.composite" point-id="composite">
		<parameter id="name" value="tolvenRESTfulAPI" />
	</extension>
	<extension id="compositeExtensionPoint.war" plugin-id="org.tolven.component.war" point-id="compositeExtensionPoint">
		<parameter id="name" value="war" />
	</extension>
	<extension-point id="devLib" extension-multiplicity="none">
		<parameter-def id="jar" default-value="devLib.jar" />
	</extension-point>

	<!-- WEB-INF ExtensionPoint -->
	<extension-point id="WEB-INF-LIB" parent-plugin-id="org.tolven.assembler.war" parent-point-id="WEB-INF-LIB">
		<parameter-def id="jar" />
	</extension-point>

	<!-- Classes ExtensionPoint -->
	<extension-point id="classes" parent-plugin-id="org.tolven.assembler.war" parent-point-id="classes">
		<parameter-def id="dir" />
	</extension-point>

	<!-- Filters -->
	<extension id="GeneralSecurityFilter" plugin-id="org.tolven.component.war" point-id="filter">
		<parameter id="filter-name" value="GeneralSecurityFilter" />
		<parameter id="filter-class" value="org.tolven.api.security.GeneralSecurityFilter" />
		<parameter id="filter-sequence" value="200" />
		<parameter id="web-resource-name" value="Secure Pages" />
		<parameter id="target-plugin-id" value="org.tolven.api" />
	</extension>
	<extension id="GeneralSecurityFilter-contribution" plugin-id="org.tolven.component.war" point-id="filter-mapping-contribution">
		<parameter id="filter-name" value="GeneralSecurityFilter" />
		<parameter id="url-pattern" value="/*" />
		<parameter id="target-plugin-id" value="org.tolven.api" />
	</extension>
	<!-- End Filters -->

	<!-- Gauntlet Security -->
	<extension id="org.tolven.restful.VestibuleResources-propertySequence" plugin-id="org.tolven.component.war" point-id="propertySequence">
		<parameter id="class" value="org.tolven.restful.VestibuleResources" />
		<parameter id="name" value="vestibuleJNDINames" />
		<parameter id="defaultSequence" value="java:app/tolvenAPI/org.tolven.api.vestibule.QuestionAnswerVestibule,java:app/tolvenAPI/org.tolven.api.vestibule.SelectAccountVestibule" />
		<parameter id="target-plugin-id" value="org.tolven.api" />
	</extension>
	<extension id="org.tolven.api.vestibule.QuestionAnswerVestibule" plugin-id="org.tolven.component.war" point-id="property">
		<parameter id="class" value="org.tolven.restful.VestibuleResources" />
		<parameter id="name" value="vestibuleJNDINames" />
		<parameter id="value" value="java:app/tolvenAPI/org.tolven.api.vestibule.QuestionAnswerVestibule" />
		<parameter id="target-plugin-id" value="org.tolven.api" />
	</extension>
	<extension id="org.tolven.api.vestibule.SelectAccountVestibule" plugin-id="org.tolven.component.war" point-id="property">
		<parameter id="class" value="org.tolven.restful.VestibuleResources" />
		<parameter id="name" value="vestibuleJNDINames" />
		<parameter id="value" value="java:app/tolvenAPI/org.tolven.api.vestibule.SelectAccountVestibule" />
		<parameter id="target-plugin-id" value="org.tolven.api" />
	</extension>
	<!-- End Gauntlet Security -->

	<!-- Security -->
	<extension id="Secure Area-security-constraint" plugin-id="org.tolven.component.war" point-id="security-constraint">
		<parameter id="web-resource-collection">
			<parameter id="web-resource-name" value="Secure pages" />
			<parameter id="url-pattern" value="/*" />
		</parameter>
		<parameter id="transport-guarantee" value="CONFIDENTIAL" />
		<parameter id="target-plugin-id" value="org.tolven.api" />
	</extension>
	<extension id="security-role" plugin-id="org.tolven.component.war" point-id="security-role">
		<parameter id="role-name" value="*" />
		<parameter id="target-plugin-id" value="org.tolven.api" />
	</extension>
	<extension id="env-entry-webContextId" plugin-id="org.tolven.component.war" point-id="env-entry">
		<parameter id="env-entry-name" value="webContextId" />
		<parameter id="env-entry-type" value="java.lang.String" />
		<parameter id="env-entry-value" value="tolvenapi" />
		<parameter id="target-plugin-id" value="org.tolven.api" />
	</extension>
	<!-- End Security -->

</plugin>