<?xml version="1.0" encoding="UTF-8"?>
<plugin id="org.tolven.mqkeystore" version="2.0.2" vendor="Tolven" xmlns="urn:tolven-org:tpf:1.0" xmlns:xsi="http://www.w3.org/2001/XMLSchema-instance" xsi:schemaLocation="urn:tolven-org:tpf:1.0 http://tolven.org/xsd/tpf.xsd">
	<requires>
		<import plugin-id="org.tolven.component.tolvenejb" />
		<import plugin-id="org.tolven.config.appserver" />
		<import plugin-id="org.tolven.component.rar" />
	</requires>
	<extension-point id="devLib" extension-multiplicity="none">
		<parameter-def id="jar" default-value="devLib.jar" />
	</extension-point>
	<extension id="libJar" plugin-id="org.tolven.config.appserver" point-id="libJar">
		<parameter id="jar" value="mqKeyStore-api.jar" />
	</extension>
	<extension id="rar" plugin-id="org.tolven.component.rar" point-id="rar">
		<parameter id="rar" value="mqKeyStore.rar" />
	</extension>
	<extension id="raClasses" plugin-id="org.tolven.component.tolvenejb" point-id="classes">
		<parameter id="dir" value="ejb/classes" />
	</extension>
</plugin>